{
  "schemaVersion": "easydep-resource-pricing/v1",
  "asOf": "2026-09-09",
  "scope": "Retail pricing equations for resources created or consumed by the AWS, Azure, and GCP Docker-on-VM deployment-plan corpus. Rates are looked up separately and are not bundled here.",
  "policy": {
    "currency": "USD",
    "missingUsage": "unknown-not-zero",
    "freeAllowance": "apply-only-with-account-remaining-allowance",
    "discounts": "on-demand-retail-only",
    "taxes": "excluded"
  },
  "sources": {
    "aws-price-list-api": {
      "title": "AWS Price List API",
      "url": "https://docs.aws.amazon.com/aws-cost-management/latest/APIReference/Welcome.html",
      "kind": "pricing-api",
      "accessedOn": "2026-09-09"
    },
    "aws-compute-pricing": {
      "title": "Amazon EC2 On-Demand pricing",
      "url": "https://aws.amazon.com/ec2/pricing/on-demand/",
      "kind": "pricing-page",
      "accessedOn": "2026-09-09"
    },
    "aws-ebs-pricing": {
      "title": "Amazon EBS pricing",
      "url": "https://aws.amazon.com/ebs/pricing/",
      "kind": "pricing-page",
      "accessedOn": "2026-09-09"
    },
    "aws-elb-pricing": {
      "title": "Elastic Load Balancing pricing",
      "url": "https://aws.amazon.com/elasticloadbalancing/pricing/",
      "kind": "pricing-page",
      "accessedOn": "2026-09-09"
    },
    "aws-vpc-pricing": {
      "title": "Amazon VPC pricing",
      "url": "https://aws.amazon.com/vpc/pricing/",
      "kind": "pricing-page",
      "accessedOn": "2026-09-09"
    },
    "aws-ecr-pricing": {
      "title": "Amazon ECR pricing",
      "url": "https://aws.amazon.com/ecr/pricing/",
      "kind": "pricing-page",
      "accessedOn": "2026-09-09"
    },
    "aws-secrets-pricing": {
      "title": "AWS Secrets Manager pricing",
      "url": "https://aws.amazon.com/secrets-manager/pricing/",
      "kind": "pricing-page",
      "accessedOn": "2026-09-09"
    },
    "azure-retail-prices-api": {
      "title": "Azure Retail Prices REST API",
      "url": "https://learn.microsoft.com/en-us/rest/api/cost-management/retail-prices/azure-retail-prices",
      "kind": "pricing-api",
      "accessedOn": "2026-09-09"
    },
    "azure-vm-pricing": {
      "title": "Azure Linux Virtual Machines pricing",
      "url": "https://azure.microsoft.com/en-us/pricing/details/virtual-machines/linux/",
      "kind": "pricing-page",
      "accessedOn": "2026-09-09"
    },
    "azure-disk-pricing": {
      "title": "Azure Managed Disks pricing",
      "url": "https://azure.microsoft.com/en-us/pricing/details/managed-disks/",
      "kind": "pricing-page",
      "accessedOn": "2026-09-09"
    },
    "azure-load-balancer-pricing": {
      "title": "Azure Load Balancer pricing",
      "url": "https://azure.microsoft.com/en-us/pricing/details/load-balancer/",
      "kind": "pricing-page",
      "accessedOn": "2026-09-09"
    },
    "azure-nat-pricing": {
      "title": "Azure NAT Gateway pricing",
      "url": "https://azure.microsoft.com/en-us/pricing/details/azure-nat-gateway/",
      "kind": "pricing-page",
      "accessedOn": "2026-09-09"
    },
    "azure-ip-pricing": {
      "title": "Azure IP address pricing",
      "url": "https://azure.microsoft.com/en-us/pricing/details/ip-addresses/",
      "kind": "pricing-page",
      "accessedOn": "2026-09-09"
    },
    "azure-acr-pricing": {
      "title": "Azure Container Registry pricing",
      "url": "https://azure.microsoft.com/en-us/pricing/details/container-registry/",
      "kind": "pricing-page",
      "accessedOn": "2026-09-09"
    },
    "azure-bandwidth-pricing": {
      "title": "Azure Bandwidth pricing",
      "url": "https://azure.microsoft.com/en-us/pricing/details/bandwidth/",
      "kind": "pricing-page",
      "accessedOn": "2026-09-09"
    },
    "azure-key-vault-pricing": {
      "title": "Azure Key Vault pricing",
      "url": "https://azure.microsoft.com/en-us/pricing/details/key-vault/",
      "kind": "pricing-page",
      "accessedOn": "2026-09-09"
    },
    "gcp-catalog-api": {
      "title": "Google Cloud Billing Catalog API",
      "url": "https://docs.cloud.google.com/billing/docs/reference/rest/v1/services.skus/list",
      "kind": "pricing-api",
      "accessedOn": "2026-09-09"
    },
    "gcp-vm-pricing": {
      "title": "Compute Engine VM instance pricing",
      "url": "https://cloud.google.com/products/compute/pricing",
      "kind": "pricing-page",
      "accessedOn": "2026-09-09"
    },
    "gcp-resource-based-pricing": {
      "title": "Compute Engine resource-based pricing",
      "url": "https://cloud.google.com/products/compute/resources/pricing",
      "kind": "billing-documentation",
      "accessedOn": "2026-09-09"
    },
    "gcp-disk-pricing": {
      "title": "Compute Engine disk and image pricing",
      "url": "https://cloud.google.com/compute/disks-image-pricing",
      "kind": "pricing-page",
      "accessedOn": "2026-09-09"
    },
    "gcp-load-balancer-pricing": {
      "title": "Cloud Load Balancing pricing",
      "url": "https://cloud.google.com/load-balancing/pricing",
      "kind": "pricing-page",
      "accessedOn": "2026-09-09"
    },
    "gcp-vpc-pricing": {
      "title": "Google Cloud VPC pricing",
      "url": "https://cloud.google.com/vpc/network-pricing",
      "kind": "pricing-page",
      "accessedOn": "2026-09-09"
    },
    "gcp-artifact-registry-pricing": {
      "title": "Artifact Registry pricing",
      "url": "https://cloud.google.com/artifact-registry/pricing",
      "kind": "pricing-page",
      "accessedOn": "2026-09-09"
    },
    "gcp-secret-manager-pricing": {
      "title": "Secret Manager pricing",
      "url": "https://cloud.google.com/secret-manager/pricing",
      "kind": "pricing-page",
      "accessedOn": "2026-09-09"
    }
  },
  "rateSources": {
    "aws": {
      "sourceRef": "aws-price-list-api",
      "access": "aws-credentials",
      "endpoint": "https://api.pricing.us-east-1.amazonaws.com",
      "matchingFields": [
        "ServiceCode",
        "productFamily",
        "location",
        "operation",
        "usageType",
        "unit",
        "beginRange",
        "endRange",
        "termType"
      ],
      "limitations": [
        "The pricing API endpoint region is not the deployment region; the product location attribute identifies the deployment region.",
        "The AWS Price List is not a complete source for limited-period Free Tier offers.",
        "If the price list and a service pricing page differ, AWS states that the service pricing page governs."
      ]
    },
    "azure": {
      "sourceRef": "azure-retail-prices-api",
      "access": "none",
      "endpoint": "https://prices.azure.com/api/retail/prices",
      "matchingFields": [
        "serviceName",
        "armRegionName",
        "armSkuName",
        "meterName",
        "priceType",
        "tierMinimumUnits",
        "unitOfMeasure",
        "effectiveStartDate"
      ],
      "limitations": [
        "Filters are case-sensitive in the current preview API.",
        "Retail prices exclude negotiated agreement pricing and taxes.",
        "Responses are paginated and current values are not a version-pinned dataset."
      ]
    },
    "gcp": {
      "sourceRef": "gcp-catalog-api",
      "access": "gcp-api-key-or-oauth",
      "endpoint": "https://cloudbilling.googleapis.com/v1/services/{service}/skus",
      "matchingFields": [
        "category.serviceDisplayName",
        "category.resourceFamily",
        "category.resourceGroup",
        "category.usageType",
        "serviceRegions",
        "pricingInfo.effectiveTime",
        "pricingInfo.pricingExpression.usageUnit",
        "pricingInfo.pricingExpression.tieredRates"
      ],
      "limitations": [
        "The Catalog API exposes public list prices, not billing-account contract prices.",
        "A Google Cloud project with the Cloud Billing API enabled and an API key or OAuth credential is required.",
        "Tiered rates and aggregation metadata must be preserved when normalizing a SKU."
      ]
    }
  },
  "coverage": {
    "aws": {
      "noSeparateMeterPrimitiveKinds": [
        "registry-pull-identity",
        "registry-pull-policy",
        "registry-pull-binding",
        "registry-instance-profile",
        "state-secret-identity",
        "state-secret-instance-profile",
        "network",
        "subnet",
        "state-subnet",
        "ingress-subnet",
        "security-group",
        "load-balancer-security-group",
        "application-ingress-rule",
        "internet-gateway",
        "ingress-route-table",
        "ingress-default-route",
        "ingress-route-association",
        "application-route-table",
        "application-default-route",
        "application-route-association"
      ],
      "notes": [
        "No separate meter means that this knowledge base found no distinct charge to attach to the primitive in the scoped pricing pages. It does not claim that all traffic or attached services are free.",
        "IAM and routing primitives can cause usage of separately metered services, which are attributed to their owning pricing rule."
      ]
    },
    "azure": {
      "noSeparateMeterPrimitiveKinds": [
        "resource-group",
        "registry-pull-identity",
        "registry-pull-binding",
        "state-secret-identity",
        "network",
        "subnet",
        "network-interface",
        "security-group",
        "security-group-association"
      ],
      "notes": [
        "No separate meter means that this knowledge base found no distinct charge to attach to the primitive in the scoped pricing pages. It does not claim that all traffic or attached services are free.",
        "Role assignments and network interfaces are structural inputs to separately metered resources and traffic."
      ]
    },
    "gcp": {
      "noSeparateMeterPrimitiveKinds": [
        "registry-pull-identity",
        "registry-pull-binding",
        "state-secret-identity",
        "network",